{
  "$schema": "https://json-schema.org/draft/2020-12/schema",
  "additionalProperties": false,
  "properties": {
    "case_id": {
      "minLength": 1,
      "type": "string"
    },
    "expected": {
      "additionalProperties": false,
      "properties": {
        "authority_created": {
          "type": "boolean"
        },
        "code": {
          "type": "string"
        },
        "effect_permitted": {
          "type": "boolean"
        },
        "recognized": {
          "type": "boolean"
        },
        "seed_resolution_created": {
          "type": "boolean"
        },
        "state_changed": {
          "type": "boolean"
        },
        "work_state": {
          "enum": [
            "UNREGISTERED",
            "RUNNING",
            "RESULT",
            "NO_RESULT"
          ]
        }
      },
      "required": [
        "recognized",
        "code",
        "state_changed",
        "work_state",
        "authority_created",
        "effect_permitted",
        "seed_resolution_created"
      ],
      "type": "object"
    },
    "polarity": {
      "enum": [
        "positive",
        "negative"
      ]
    },
    "steps": {
      "items": {
        "additionalProperties": false,
        "properties": {
          "kind": {
            "type": "string"
          },
          "payload": {
            "type": "object"
          }
        },
        "required": [
          "kind",
          "payload"
        ],
        "type": "object"
      },
      "minItems": 1,
      "type": "array"
    }
  },
  "required": [
    "case_id",
    "polarity",
    "steps",
    "expected"
  ],
  "type": "object"
}
