{
  "case_id": "WORKER-POS-005",
  "expected": {
    "authority_created": false,
    "code": "IDEMPOTENT_REPLAY",
    "effect_permitted": false,
    "recognized": true,
    "seed_resolution_created": false,
    "state_changed": false,
    "work_state": "RESULT"
  },
  "polarity": "positive",
  "steps": [
    {
      "kind": "START_WORK",
      "payload": {
        "work_binding_digest": "sha256:1111111111111111111111111111111111111111111111111111111111111111",
        "work_descriptor_binding": "sha256:3333333333333333333333333333333333333333333333333333333333333333",
        "work_id": "work:1",
        "worker_binding": "sha256:2222222222222222222222222222222222222222222222222222222222222222"
      }
    },
    {
      "kind": "END_WORK",
      "payload": {
        "evidence_bindings": [
          "sha256:9999999999999999999999999999999999999999999999999999999999999999"
        ],
        "terminal_binding": "sha256:8888888888888888888888888888888888888888888888888888888888888888",
        "terminal_kind": "RESULT",
        "terminal_record_digest": "sha256:7777777777777777777777777777777777777777777777777777777777777777",
        "work_binding_digest": "sha256:1111111111111111111111111111111111111111111111111111111111111111",
        "work_id": "work:1"
      }
    },
    {
      "kind": "END_WORK",
      "payload": {
        "evidence_bindings": [
          "sha256:9999999999999999999999999999999999999999999999999999999999999999"
        ],
        "terminal_binding": "sha256:8888888888888888888888888888888888888888888888888888888888888888",
        "terminal_kind": "RESULT",
        "terminal_record_digest": "sha256:7777777777777777777777777777777777777777777777777777777777777777",
        "work_binding_digest": "sha256:1111111111111111111111111111111111111111111111111111111111111111",
        "work_id": "work:1"
      }
    }
  ]
}
