{
  "case_id": "WORKER-POS-004",
  "expected": {
    "authority_created": false,
    "code": "IDEMPOTENT_REPLAY",
    "effect_permitted": false,
    "recognized": true,
    "seed_resolution_created": false,
    "state_changed": false,
    "work_state": "RUNNING"
  },
  "polarity": "positive",
  "steps": [
    {
      "kind": "START_WORK",
      "payload": {
        "work_binding_digest": "sha256:1111111111111111111111111111111111111111111111111111111111111111",
        "work_descriptor_binding": "sha256:3333333333333333333333333333333333333333333333333333333333333333",
        "work_id": "work:1",
        "worker_binding": "sha256:2222222222222222222222222222222222222222222222222222222222222222"
      }
    },
    {
      "kind": "START_WORK",
      "payload": {
        "work_binding_digest": "sha256:1111111111111111111111111111111111111111111111111111111111111111",
        "work_descriptor_binding": "sha256:3333333333333333333333333333333333333333333333333333333333333333",
        "work_id": "work:1",
        "worker_binding": "sha256:2222222222222222222222222222222222222222222222222222222222222222"
      }
    }
  ]
}
